{
  "user_stories": [
    {
      "id": "absa-group/aul-ui/US-2",
      "repository_name": "aul-ui",
      "title": "View Dashboard",
      "state": "active",
      "tags": [],
      "url": "https://github.com/absa-group/aul-ui/blob/main/dashboard.feature",
      "timestamps": null,
      "description": "As a user, I want a dashboard overview.",
      "business_value": [],
      "preconditions": [],
      "not_in_scope": [],
      "deprecated_at": null,
      "deprecation_reason": null,
      "acceptance_criteria": [
        {
          "id": "US-2-01",
          "state": "Active",
          "version": "v1.0.0",
          "description": "User can see accessible domains on the dashboard.",
          "aspect": [],
          "preconditions": [],
          "not_in_scope": [],
          "removal_planned": null,
          "descoped_at": null,
          "descoped_reason": null,
          "future_release": null
        },
        {
          "id": "US-2-02",
          "state": "Active",
          "version": "v1.0.0",
          "description": "Dashboard shows an empty state when no domains are accessible.",
          "aspect": [],
          "preconditions": [],
          "not_in_scope": [],
          "removal_planned": null,
          "descoped_at": null,
          "descoped_reason": null,
          "future_release": null
        }
      ]
    },
    {
      "id": "absa-group/aul-ui/US-7",
      "repository_name": "aul-ui",
      "title": "Delete Domain",
      "state": "active",
      "tags": [],
      "url": "https://github.com/absa-group/aul-ui/blob/main/delete_domain.feature",
      "timestamps": null,
      "description": "As a user, I want to delete a domain.",
      "business_value": [],
      "preconditions": [],
      "not_in_scope": [],
      "deprecated_at": null,
      "deprecation_reason": null,
      "acceptance_criteria": []
    },
    {
      "id": "absa-group/aul-ui/US-1",
      "repository_name": "aul-ui",
      "title": "User Login",
      "state": "active",
      "tags": [],
      "url": "https://github.com/absa-group/aul-ui/blob/main/user_login.feature",
      "timestamps": null,
      "description": "As a user, I want to log in so that I can access the application.",
      "business_value": [
        "Users can reach the application securely."
      ],
      "preconditions": [
        "The user has a registered account."
      ],
      "not_in_scope": [],
      "deprecated_at": null,
      "deprecation_reason": null,
      "acceptance_criteria": [
        {
          "id": "US-1-01",
          "state": "Active",
          "version": "v1.0.0",
          "description": "User can log in with valid credentials.",
          "aspect": [],
          "preconditions": [
            "The user has a registered account."
          ],
          "not_in_scope": [],
          "removal_planned": null,
          "descoped_at": null,
          "descoped_reason": null,
          "future_release": null
        },
        {
          "id": "US-1-02",
          "state": "Active",
          "version": "v1.0.0",
          "description": "Login button is disabled until both fields are filled.",
          "aspect": [],
          "preconditions": [
            "The user has a registered account."
          ],
          "not_in_scope": [],
          "removal_planned": null,
          "descoped_at": null,
          "descoped_reason": null,
          "future_release": null
        },
        {
          "id": "US-1-03",
          "state": "Deprecated",
          "version": "v0.9.0",
          "description": "Legacy basic-auth login (removed).",
          "aspect": [],
          "preconditions": [
            "The user has a registered account."
          ],
          "not_in_scope": [],
          "removal_planned": null,
          "descoped_at": null,
          "descoped_reason": null,
          "future_release": null
        }
      ]
    }
  ],
  "functionalities": [],
  "features": [],
  "metadata": {
    "producer": {
      "name": "AbsaOSS/living-doc-collector-gh",
      "version": "0.1.1",
      "build": null
    },
    "run": {
      "run_id": null,
      "run_attempt": null,
      "actor": null,
      "workflow": null,
      "ref": null,
      "sha": null
    },
    "source": {
      "systems": [
        "GitHub"
      ],
      "repositories": [
        "absa-group/aul-ui"
      ],
      "organization": "absa-group",
      "enterprise": null
    },
    "original_metadata": {
      "generated_at": "2026-01-01T00:00:00+00:00",
      "schema_version": "1.0.0",
      "inputs": {}
    }
  },
  "warnings": []
}
